{
  "schemaVersion": 1,
  "generatedAt": "2026-07-28T10:10:53.855Z",
  "repo": "https://github.com/xucux/i-code-script-templates",
  "ref": "main",
  "items": [
    {
      "id": "balance/grok-usage",
      "slug": "grok-usage",
      "name": "公益 Grok 额度监控",
      "kind": "balance",
      "engine": "rhai",
      "author": "i-code",
      "description": "通过 x-api-key 鉴权查询公益 Grok 额度：剩余额度金额、已用金额、额度上限、剩余百分比、今日/累计 Token、今日请求次数、账户状态。",
      "tags": [
        "grok",
        "xai",
        "public",
        "api-key"
      ],
      "version": "1.0.0",
      "createdAt": "2026-07-28T00:00:00Z",
      "updatedAt": "2026-07-28T00:00:00Z",
      "path": "templates/balance/grok-usage",
      "metaPath": "templates/balance/grok-usage/meta.json",
      "scriptPath": "templates/balance/grok-usage/script.rhai",
      "defaultTimeoutMs": 15000,
      "allowedHosts": [
        "sub.yxxb.eu.cc"
      ]
    },
    {
      "id": "balance/joyagent-balance",
      "slug": "joyagent-balance",
      "name": "京东 JoyAgent 积分查询",
      "kind": "balance",
      "engine": "rhai",
      "author": "i-code",
      "description": "Cookie 鉴权查询京东 JoyAgent 积分：剩余积分、积分上限（常量 500000）、已用积分、剩余百分比、优惠券金额、钱包金额、欠款金额。",
      "tags": [
        "jd",
        "joyagent",
        "cookie",
        "points"
      ],
      "version": "1.0.0",
      "createdAt": "2026-07-28T00:00:00Z",
      "updatedAt": "2026-07-28T00:00:00Z",
      "path": "templates/balance/joyagent-balance",
      "metaPath": "templates/balance/joyagent-balance/meta.json",
      "scriptPath": "templates/balance/joyagent-balance/script.rhai",
      "defaultTimeoutMs": 15000,
      "allowedHosts": [
        "agentrs.jd.com"
      ]
    },
    {
      "id": "balance/mimo-balance",
      "slug": "mimo-balance",
      "name": "小米 MiMo 按量计费额度查询",
      "kind": "balance",
      "engine": "rhai",
      "author": "i-code",
      "description": "Cookie 鉴权查询小米 MiMo 按量计费余额：总余额、现金余额、赠送余额、冻结金额、透支额度。",
      "tags": [
        "xiaomi",
        "mimo",
        "balance",
        "cookie"
      ],
      "version": "1.0.0",
      "createdAt": "2026-07-28T00:00:00Z",
      "updatedAt": "2026-07-28T00:00:00Z",
      "path": "templates/balance/mimo-balance",
      "metaPath": "templates/balance/mimo-balance/meta.json",
      "scriptPath": "templates/balance/mimo-balance/script.rhai",
      "defaultTimeoutMs": 15000,
      "allowedHosts": [
        "platform.xiaomimimo.com"
      ]
    },
    {
      "id": "balance/mimo-token-plan",
      "slug": "mimo-token-plan",
      "name": "小米 MiMo 套餐积分查询",
      "kind": "balance",
      "engine": "rhai",
      "author": "i-code",
      "description": "Cookie 鉴权查询小米 MiMo 套餐积分用量：套餐积分、补偿积分及消耗百分比。积分值单位：百M（1000000 原始积分 = 1 百M）。",
      "tags": [
        "xiaomi",
        "mimo",
        "token-plan",
        "cookie"
      ],
      "version": "1.0.0",
      "createdAt": "2026-07-28T00:00:00Z",
      "updatedAt": "2026-07-28T00:00:00Z",
      "path": "templates/balance/mimo-token-plan",
      "metaPath": "templates/balance/mimo-token-plan/meta.json",
      "scriptPath": "templates/balance/mimo-token-plan/script.rhai",
      "defaultTimeoutMs": 15000,
      "allowedHosts": [
        "platform.xiaomimimo.com"
      ]
    }
  ]
}
